videoId,textDisplay,textOriginal,authorDisplayName,authorProfileImageUrl,authorChannelUrl,authorChannelId,canRate,viewerRating,likeCount,publishedAt,updatedAt,parentId,commentId
yiffzzl7EFY,Haha bisa bae dokter,Haha bisa bae dokter,Almira Dan salma,https://yt3.ggpht.com/ytc/AL5GRJXiWATUCRCYncyDCysg7R1xsCG0fILkIAReAw=s48-c-k-c0x00ffffff-no-rj,http://www.youtube.com/channel/UCX0lAiGIdY8ajOnq0wIUXKw,{'value': 'UCX0lAiGIdY8ajOnq0wIUXKw'},True,none,0,2022-10-23T06:35:09Z,2022-10-23T06:35:09Z,,UgzJ1CFfqwuWOX7YI4V4AaABAg
yiffzzl7EFY,Fungsi BPOM kmna oiii Badan pengawas obat mkanan...cm mkan gaji buta sj mreka bubarkan sj gak ada gunanya Bpom,Fungsi BPOM kmna oiii Badan pengawas obat mkanan...cm mkan gaji buta sj mreka bubarkan sj gak ada gunanya Bpom,andies wahyudianto,https://yt3.ggpht.com/ytc/AL5GRJUSa4dBIMYeJL28eHDxU1zaXgcJcumYhakbjQ=s48-c-k-c0x00ffffff-no-rj,http://www.youtube.com/channel/UCyxvu-ddsXhG9I8ApfzBDAQ,{'value': 'UCyxvu-ddsXhG9I8ApfzBDAQ'},True,none,0,2022-10-23T06:32:52Z,2022-10-23T06:32:52Z,,UgwUavcMpjnM2LE5noN4AaABAg
yiffzzl7EFY,yg pernah liat channel dr ricard pasti buru2 bilang gk ada wkwkwkw harusnya jgn dr ricard yg beli yg beli orang lain aja,yg pernah liat channel dr ricard pasti buru2 bilang gk ada wkwkwkw harusnya jgn dr ricard yg beli yg beli orang lain aja,Pencari Fakta,https://yt3.ggpht.com/VbCWDmEoMK4QrBTyYcxYH8zLd_b98CX2wkxP_NEkGUcmg2nVa-N4nc7COToOo_YwHER61xunAA=s48-c-k-c0x00ffffff-no-rj,http://www.youtube.com/channel/UCqUi6DJNYoBE6CQaID5U3YA,{'value': 'UCqUi6DJNYoBE6CQaID5U3YA'},True,none,0,2022-10-23T06:32:15Z,2022-10-23T06:32:34Z,,UgwlNoT_T_bJNEfQf054AaABAg
yiffzzl7EFY,"Kenapa baru sekarang pemberitahuannya, sdangkan merek obat itu udh lama beredar di apotik.. Sdh jutaan org yg konsumsi.. Gak ada kerjaan ni kemenkes dan bpom.","Kenapa baru sekarang pemberitahuannya, sdangkan merek obat itu udh lama beredar di apotik.. Sdh jutaan org yg konsumsi.. Gak ada kerjaan ni kemenkes dan bpom.",H2MX,https://yt3.ggpht.com/U3PZejFkpcJyXdMLN0h3N11CXM_c4w7MTcjPTkTIaoAzLBh33lZS_hb66o_xYY9wTuqZG6rCRg=s48-c-k-c0x00ffffff-no-rj,http://www.youtube.com/channel/UCZvLM0xrplj6R-04HvVU-ng,{'value': 'UCZvLM0xrplj6R-04HvVU-ng'},True,none,0,2022-10-23T06:32:09Z,2022-10-23T06:32:09Z,,UgwQyFKnh6zTky8UZvN4AaABAg
yiffzzl7EFY,Ya jangan beli walau mereka jual,Ya jangan beli walau mereka jual,mohamad to'at,https://yt3.ggpht.com/ytc/AL5GRJWxT4_hbUuSM4o0dc67klRklS_fwvQF94rmhjPRkQ=s48-c-k-c0x00ffffff-no-rj,http://www.youtube.com/channel/UCKg2P1sR6EptowJ6gLK6bKg,{'value': 'UCKg2P1sR6EptowJ6gLK6bKg'},True,none,0,2022-10-23T06:29:54Z,2022-10-23T06:29:54Z,UgzlVbHzn5Mo0bJnuHJ4AaABAg,UgzlVbHzn5Mo0bJnuHJ4AaABAg.9hWSwZbeCCf9hWTB-9LUPS
yiffzzl7EFY,"Di tempatku, yang dekat rumah juga masih jual. Di toko yang lumayan besar. Cek lokasi kemarin dan pagi ini.","Di tempatku, yang dekat rumah juga masih jual. Di toko yang lumayan besar. Cek lokasi kemarin dan pagi ini.",Ayo Ngguyu,https://yt3.ggpht.com/ytc/AL5GRJV5AbRse_DMERGD_H80LbEZkdFk2lVZPOB40w=s48-c-k-c0x00ffffff-no-rj,http://www.youtube.com/channel/UC9EfmUsHqrfbkJtg1xl4QEA,{'value': 'UC9EfmUsHqrfbkJtg1xl4QEA'},True,none,1,2022-10-23T06:27:06Z,2022-10-23T06:27:06Z,,UgxTGargiME99ciLt494AaABAg
yiffzzl7EFY,"Kmrn adik sy yg kerja di RS sih ngasih tau klo yg dilarang dr BPOM hny 5 jenis obat sih mba,,,,","Kmrn adik sy yg kerja di RS sih ngasih tau klo yg dilarang dr BPOM hny 5 jenis obat sih mba,,,,",andi yogantoro,https://yt3.ggpht.com/ytc/AL5GRJXtRZ9lK2CdAwSi8wSnEj4kQq_gsDBYZtXb6agH=s48-c-k-c0x00ffffff-no-rj,http://www.youtube.com/channel/UCj1Bp948gQO0_flji5M7Azg,{'value': 'UCj1Bp948gQO0_flji5M7Azg'},True,none,0,2022-10-23T07:41:14Z,2022-10-23T07:41:14Z,Ugzzj_GlgGCihKVRVpN4AaABAg,Ugzzj_GlgGCihKVRVpN4AaABAg.9hWSSFFKbka9hWaLTUGm72
yiffzzl7EFY,Mau dong kopinya gimba crnya pembeliannya dr,Mau dong kopinya gimba crnya pembeliannya dr,supriadi adi,https://yt3.ggpht.com/ytc/AL5GRJUMdRp0hotg6iUa44Cf7hZ_x1LxjA32PrzPVA=s48-c-k-c0x00ffffff-no-rj,http://www.youtube.com/channel/UCBCthvCSxKZX--ZYSWQAjlA,{'value': 'UCBCthvCSxKZX--ZYSWQAjlA'},True,none,0,2022-10-23T06:21:44Z,2022-10-23T06:21:44Z,,Ugw9RJ9dc7chDC4lIMp4AaABAg
yiffzzl7EFY,"Mau diapain lagi sih rakyat indonesia ini,  mau diracun yh...?, kalo sudah byk yg mati.....ada rencana apa lgi yah...? Apa ada sesuatu akan terjadi seperti pandemi kemarin...?? seperti nya pemerintah setengah setengah menangani masalah ini,","Mau diapain lagi sih rakyat indonesia ini,  mau diracun yh...?, kalo sudah byk yg mati.....ada rencana apa lgi yah...? Apa ada sesuatu akan terjadi seperti pandemi kemarin...?? seperti nya pemerintah setengah setengah menangani masalah ini,",martin1_90,https://yt3.ggpht.com/AHhcTqvEA_mHdTs7gwtR-Fv68Zv1o0njleupkemMXaHgmponjnwUYpNeiqwOMzXJWmRfLSgv=s48-c-k-c0x00ffffff-no-rj,http://www.youtube.com/channel/UCkdP8HMybLnVX5f3RTixMPw,{'value': 'UCkdP8HMybLnVX5f3RTixMPw'},True,none,0,2022-10-23T06:19:41Z,2022-10-23T06:19:41Z,,UgwqE7fxoZJxSHOrRph4AaABAg
yiffzzl7EFY,Beli aja mbak parasetamol yg masuk lewat anus<br><br>Aku aja ada stok dkulkas buat jaga2 aja,"Beli aja mbak parasetamol yg masuk lewat anus

Aku aja ada stok dkulkas buat jaga2 aja",ruqoyah,https://yt3.ggpht.com/ytc/AL5GRJV2e8sczbYiBi5zVp0sM7Cq4qUYblhQaaf0qw-ChQZx_ZuqOCYK-ug9-Z4aNh_C=s48-c-k-c0x00ffffff-no-rj,http://www.youtube.com/channel/UCnGRihvX0CbMenFmn5sY1AA,{'value': 'UCnGRihvX0CbMenFmn5sY1AA'},True,none,1,2022-10-23T09:49:23Z,2022-10-23T09:49:45Z,UgxHWzQcN6S6uvBQmal4AaABAg,UgxHWzQcN6S6uvBQmal4AaABAg.9hWRiCGJc1Y9hWp03W8MjN
yiffzzl7EFY,"Beli yg tablet aja kak digerus klo anak msh balita mmng sih ribet tp yg penting anak kita aman dl,,,anak sy kmrn bapil jg GT diksh nya tablet SM puyer,,,semoga cpt ada kejelasan mengenai obat biar para emak&quot; enggak panik dan anak pun aman&quot; aja mnm obat cair","Beli yg tablet aja kak digerus klo anak msh balita mmng sih ribet tp yg penting anak kita aman dl,,,anak sy kmrn bapil jg GT diksh nya tablet SM puyer,,,semoga cpt ada kejelasan mengenai obat biar para emak"" enggak panik dan anak pun aman"" aja mnm obat cair",andi yogantoro,https://yt3.ggpht.com/ytc/AL5GRJXtRZ9lK2CdAwSi8wSnEj4kQq_gsDBYZtXb6agH=s48-c-k-c0x00ffffff-no-rj,http://www.youtube.com/channel/UCj1Bp948gQO0_flji5M7Azg,{'value': 'UCj1Bp948gQO0_flji5M7Azg'},True,none,0,2022-10-23T07:36:54Z,2022-10-23T07:36:54Z,UgxHWzQcN6S6uvBQmal4AaABAg,UgxHWzQcN6S6uvBQmal4AaABAg.9hWRiCGJc1Y9hW_qkW1KU8
yiffzzl7EFY,Laa aku juga bingung. Sering nyetok Paracetamol.,Laa aku juga bingung. Sering nyetok Paracetamol.,Ayo Ngguyu,https://yt3.ggpht.com/ytc/AL5GRJV5AbRse_DMERGD_H80LbEZkdFk2lVZPOB40w=s48-c-k-c0x00ffffff-no-rj,http://www.youtube.com/channel/UC9EfmUsHqrfbkJtg1xl4QEA,{'value': 'UC9EfmUsHqrfbkJtg1xl4QEA'},True,none,0,2022-10-23T06:30:22Z,2022-10-23T06:30:22Z,UgxHWzQcN6S6uvBQmal4AaABAg,UgxHWzQcN6S6uvBQmal4AaABAg.9hWRiCGJc1Y9hWTEOa2zvG
yiffzzl7EFY,Mantappp Dok,Mantappp Dok,GBMO Official,https://yt3.ggpht.com/IfalNJl8rbrtqESaT1CU-a6RRR5ytMq7J8sdP9RPCYYLxl81ezuShVdCRtywksb9xfsMUchzMQ=s48-c-k-c0x00ffffff-no-rj,http://www.youtube.com/channel/UCWunRW5Z-PowcNhtrZC_xVg,{'value': 'UCWunRW5Z-PowcNhtrZC_xVg'},True,none,0,2022-10-23T06:16:32Z,2022-10-23T06:16:32Z,,UgwDBKa42AFyx37mgSh4AaABAg
yiffzzl7EFY,Gmn dengan vitamin yg sirup dok....?,Gmn dengan vitamin yg sirup dok....?,Uswatun Khasanah,https://yt3.ggpht.com/ytc/AL5GRJVVSvZ4k6gf12fD0z-PHC2eLH_E05voQHDjJg=s48-c-k-c0x00ffffff-no-rj,http://www.youtube.com/channel/UCUc0VzC4DBaG1kR6u-cpP9g,{'value': 'UCUc0VzC4DBaG1kR6u-cpP9g'},True,none,2,2022-10-23T06:06:27Z,2022-10-23T06:06:27Z,,UgxEvZWnC4GD1HkDP5d4AaABAg
yiffzzl7EFY,Pemerintah bisanya cuma perintah sementara penjual obat batuk sirup mana mau rugi lah mereka. Yg ada penjual menghabiskan stok dulu kecuali kalau pemerintah MAU ganti rugi.,Pemerintah bisanya cuma perintah sementara penjual obat batuk sirup mana mau rugi lah mereka. Yg ada penjual menghabiskan stok dulu kecuali kalau pemerintah MAU ganti rugi.,Binomo Sukses,https://yt3.ggpht.com/ytc/AL5GRJULHYOlyFd8UdGC5i4kY-ZEy9pE_e8UadoJKfet6mIcSwGj8f3UGOjBGb4-71Yg=s48-c-k-c0x00ffffff-no-rj,http://www.youtube.com/channel/UC83WZya-PWF3vmABdf-NzYw,{'value': 'UC83WZya-PWF3vmABdf-NzYw'},True,none,1,2022-10-23T06:04:51Z,2022-10-23T06:04:51Z,,UgxEngvVcZJKuOlPc1t4AaABAg
yiffzzl7EFY,Mungkin kita benci pahala  dan bangga dengan dosa dosa,Mungkin kita benci pahala  dan bangga dengan dosa dosa,Carla,https://yt3.ggpht.com/ytc/AL5GRJXjeDGj5dTseOb2d2nLPKwLrxcyTc9YDt25Sg=s48-c-k-c0x00ffffff-no-rj,http://www.youtube.com/channel/UCu93Y4aDi3GCbfw6HulnIrA,{'value': 'UCu93Y4aDi3GCbfw6HulnIrA'},True,none,0,2022-10-23T06:11:24Z,2022-10-23T06:11:24Z,Ugz11CFbIB66YBjucbN4AaABAg,Ugz11CFbIB66YBjucbN4AaABAg.9hWPwnuC1gv9hWR3UlaueV
yiffzzl7EFY,Boleh asal madu asli yg asli jgn madurasa,Boleh asal madu asli yg asli jgn madurasa,Aulia Yagami,https://yt3.ggpht.com/ytc/AL5GRJXPuFJnhzBuV_dxKY2aQlxlqq7uv20W_hyUFg=s48-c-k-c0x00ffffff-no-rj,http://www.youtube.com/channel/UCLWeIpvupamHKc1OzWU_PSg,{'value': 'UCLWeIpvupamHKc1OzWU_PSg'},True,none,0,2022-10-23T08:13:02Z,2022-10-23T08:13:02Z,UgxrOvbHcxEC-YSN5V94AaABAg,UgxrOvbHcxEC-YSN5V94AaABAg.9hWPf69mlr49hWdzOZ9oF8
yiffzzl7EFY,Warung ms di jual dok,Warung ms di jual dok,Ray Nita,https://yt3.ggpht.com/ytc/AL5GRJUceg0yktllKABZpwuyE26KGyYsI34M1DGNBvGkIQ=s48-c-k-c0x00ffffff-no-rj,http://www.youtube.com/channel/UCm1DQcE48rJa70iwGZ8iHEA,{'value': 'UCm1DQcE48rJa70iwGZ8iHEA'},True,none,0,2022-10-23T05:59:08Z,2022-10-23T05:59:08Z,,Ugw5-_bLn0lZBC60VcV4AaABAg
yiffzzl7EFY,"moga niat baik dr Lee gak ada plintir ,, sehat terus dok","moga niat baik dr Lee gak ada plintir ,, sehat terus dok",Kusuma Wijaya,https://yt3.ggpht.com/2N_UO3jchKfMEGl3sQtLctQKABzafzTaaIcc2lV42eVogU5We5RUKnktgxlp679WIQooqEU5oAs=s48-c-k-c0x00ffffff-no-rj,http://www.youtube.com/channel/UCIgGpwI5fSVL_9urulkOuHg,{'value': 'UCIgGpwI5fSVL_9urulkOuHg'},True,none,3,2022-10-23T05:56:26Z,2022-10-23T05:56:26Z,,UgzXZBIdv5Y_oHYJI2x4AaABAg
yiffzzl7EFY,Tempra dan hufagrif blh ga ya,Tempra dan hufagrif blh ga ya,nisa,https://yt3.ggpht.com/P-gzHWFo6sjhdvFi5wKNNyDWYIcFRn1UJ7fVqreQKyRgHxrHYX3EIlfwyMBY-CzoVJu3Cvb88Lg=s48-c-k-c0x00ffffff-no-rj,http://www.youtube.com/channel/UCWJwhgi-eFbGCpA2RhQ6lpQ,{'value': 'UCWJwhgi-eFbGCpA2RhQ6lpQ'},True,none,0,2022-10-23T14:27:40Z,2022-10-23T14:27:40Z,UgzVaHe7REY_XAGQ_NJ4AaABAg,UgzVaHe7REY_XAGQ_NJ4AaABAg.9hWPE8BfEwG9hXJrIgzbQl
yiffzzl7EFY,Paracetamol bole mba,Paracetamol bole mba,Veronika Ulva,https://yt3.ggpht.com/ytc/AL5GRJV6fh26F5UZnMxoISe9mTpwWaYpbSSl2zDunZ3u0PM=s48-c-k-c0x00ffffff-no-rj,http://www.youtube.com/channel/UC2bY4Wmrrb53-FRWqepEiZA,{'value': 'UC2bY4Wmrrb53-FRWqepEiZA'},True,none,0,2022-10-23T14:07:44Z,2022-10-23T14:07:44Z,UgzVaHe7REY_XAGQ_NJ4AaABAg,UgzVaHe7REY_XAGQ_NJ4AaABAg.9hWPE8BfEwG9hXH_IjeWFk
yiffzzl7EFY,bukanx yg merek sanmol itu aman y bun,bukanx yg merek sanmol itu aman y bun,why,https://yt3.ggpht.com/cg2Flfd9PiI5wd7y_fb0nD9k9iuLknIwsB7SHDOAOC4NzXaFuVME08zsvgf0r-FffEuW-8BLnPA=s48-c-k-c0x00ffffff-no-rj,http://www.youtube.com/channel/UCLqEITOIgKctiCUDrDW1SVg,{'value': 'UCLqEITOIgKctiCUDrDW1SVg'},True,none,0,2022-10-23T12:54:47Z,2022-10-23T12:54:47Z,UgzVaHe7REY_XAGQ_NJ4AaABAg,UgzVaHe7REY_XAGQ_NJ4AaABAg.9hWPE8BfEwG9hX9DxO8mRC
yiffzzl7EFY,"Makasi dok, aku apoteker kerja di apotek jg, semangt terus buat kontennya","Makasi dok, aku apoteker kerja di apotek jg, semangt terus buat kontennya",il Il,https://yt3.ggpht.com/ytc/AL5GRJWYwCaWEoWf85dXsoud_h1T9EeNJ3r4sTssHg=s48-c-k-c0x00ffffff-no-rj,http://www.youtube.com/channel/UC6yc8ynZKZXizZRpe6rnp2g,{'value': 'UC6yc8ynZKZXizZRpe6rnp2g'},True,none,0,2022-10-23T05:54:55Z,2022-10-23T05:54:55Z,,UgzwjoH7Tso_77L0df54AaABAg
yiffzzl7EFY,🇧🇳5 yg dlarang tempat sya dom,🇧🇳5 yg dlarang tempat sya dom,Wars Wars,https://yt3.ggpht.com/ytc/AL5GRJU_ipqEecAoEvAXwAppKRXXtxKFtyR5ddyuwQ=s48-c-k-c0x00ffffff-no-rj,http://www.youtube.com/channel/UCjfXEpkZRgWWIwYAN14lIaw,{'value': 'UCjfXEpkZRgWWIwYAN14lIaw'},True,none,0,2022-10-23T05:53:13Z,2022-10-23T05:53:13Z,,Ugxv1F3nNxH90DOvMqV4AaABAg
yiffzzl7EFY,"@Safwaan khedira Yusuf kepuskesmas aja murah kak,,,,klinik bukannya bs kn pk BPJS kak","@Safwaan khedira Yusuf kepuskesmas aja murah kak,,,,klinik bukannya bs kn pk BPJS kak",andi yogantoro,https://yt3.ggpht.com/ytc/AL5GRJXtRZ9lK2CdAwSi8wSnEj4kQq_gsDBYZtXb6agH=s48-c-k-c0x00ffffff-no-rj,http://www.youtube.com/channel/UCj1Bp948gQO0_flji5M7Azg,{'value': 'UCj1Bp948gQO0_flji5M7Azg'},True,none,0,2022-10-23T07:44:47Z,2022-10-23T07:44:47Z,Ugx3ODGpwTBpClPRCzN4AaABAg,Ugx3ODGpwTBpClPRCzN4AaABAg.9hWOgU5LYHx9hWakU1kq2J
yiffzzl7EFY,@andi yogantoro klw k dktr double duitny..bingung mw gmna lg..,@andi yogantoro klw k dktr double duitny..bingung mw gmna lg..,Safwaan khedira Yusuf,https://yt3.ggpht.com/ytc/AL5GRJV-aI7F5QdGELJKyps1A7HGppqEGD5RO3PY33Qjlg=s48-c-k-c0x00ffffff-no-rj,http://www.youtube.com/channel/UCN1LQ8bjvXvC44GHsQaBjJQ,{'value': 'UCN1LQ8bjvXvC44GHsQaBjJQ'},True,none,0,2022-10-23T07:35:54Z,2022-10-23T07:35:54Z,Ugx3ODGpwTBpClPRCzN4AaABAg,Ugx3ODGpwTBpClPRCzN4AaABAg.9hWOgU5LYHx9hW_jRzKQ70
yiffzzl7EFY,"Daerah rumah sy Munjul Jaktim bnyk klinik yg buka 24 jam,,,,tp mmng betul kmrn anak sy berobat ke Puskesmas obatnya tablet SM puyer semua kecuali antibiotik","Daerah rumah sy Munjul Jaktim bnyk klinik yg buka 24 jam,,,,tp mmng betul kmrn anak sy berobat ke Puskesmas obatnya tablet SM puyer semua kecuali antibiotik",andi yogantoro,https://yt3.ggpht.com/ytc/AL5GRJXtRZ9lK2CdAwSi8wSnEj4kQq_gsDBYZtXb6agH=s48-c-k-c0x00ffffff-no-rj,http://www.youtube.com/channel/UCj1Bp948gQO0_flji5M7Azg,{'value': 'UCj1Bp948gQO0_flji5M7Azg'},True,none,0,2022-10-23T07:27:53Z,2022-10-23T07:45:05Z,Ugx3ODGpwTBpClPRCzN4AaABAg,Ugx3ODGpwTBpClPRCzN4AaABAg.9hWOgU5LYHx9hWZojsZg_i
yiffzzl7EFY,Tidak jgn dulu,Tidak jgn dulu,Aulia Yagami,https://yt3.ggpht.com/ytc/AL5GRJXPuFJnhzBuV_dxKY2aQlxlqq7uv20W_hyUFg=s48-c-k-c0x00ffffff-no-rj,http://www.youtube.com/channel/UCLWeIpvupamHKc1OzWU_PSg,{'value': 'UCLWeIpvupamHKc1OzWU_PSg'},True,none,0,2022-10-23T08:13:31Z,2022-10-23T08:13:31Z,UgyPdLd51fAA2elfjNx4AaABAg,UgyPdLd51fAA2elfjNx4AaABAg.9hWObNZEyPl9hWe1wJSFhD
yiffzzl7EFY,Pake kamera tersembunyi dok 😀,Pake kamera tersembunyi dok 😀,JOH NIEL SAN EP,https://yt3.ggpht.com/x2RoOOE0PS55608_FaWYuZ4NbtuCTOtTPt-fMadxaJVIgcaYU415a68i5xP4_Xp-dvXat4BRJg=s48-c-k-c0x00ffffff-no-rj,http://www.youtube.com/channel/UC__V4o-Xz2OcJAcEx3T5K3g,{'value': 'UC__V4o-Xz2OcJAcEx3T5K3g'},True,none,0,2022-10-23T05:48:27Z,2022-10-23T05:48:27Z,,Ugw5w6cysqFiYbRchMl4AaABAg
yiffzzl7EFY,Kan dok jdi minta foto kn hehe SM dok nti sy klw ktmu dr.selfi jg ya dok hihihi🙏,Kan dok jdi minta foto kn hehe SM dok nti sy klw ktmu dr.selfi jg ya dok hihihi🙏,Herlin Sawara,https://yt3.ggpht.com/ytc/AL5GRJUXk6KnM1Ysy3kaKdQ8nLrRRMzEKQTe_N5gm7iVow=s48-c-k-c0x00ffffff-no-rj,http://www.youtube.com/channel/UCFSCqrYA7vmga3aRVzX6Xrw,{'value': 'UCFSCqrYA7vmga3aRVzX6Xrw'},True,none,0,2022-10-23T05:45:26Z,2022-10-23T05:45:58Z,,Ugz-Gu8hqtCtGvkuWQN4AaABAg
yiffzzl7EFY,Bangga banget sama dokter ricard,Bangga banget sama dokter ricard,Arrie Mania,https://yt3.ggpht.com/PlGPbMumBRvZSbwowQlRyjY_ylJ5GD3EXd0ZbPzto_b9b_KyIswDhN7nA2r07b4O2lBjWUst=s48-c-k-c0x00ffffff-no-rj,http://www.youtube.com/channel/UCj_t3KB4Sp6dqiCdENdnX0Q,{'value': 'UCj_t3KB4Sp6dqiCdENdnX0Q'},True,none,3,2022-10-23T05:45:17Z,2022-10-23T05:45:17Z,,UgzjcVBeThnJ-prUA7p4AaABAg
yiffzzl7EFY,keren pak dokter 🥰💖,keren pak dokter 🥰💖,Yuni Dani,https://yt3.ggpht.com/zyV23eVwPVNbOD-hIrJkkeRT7ChCVRBhru0FeVMx6xMLOjIlR3r5Z52HjldOHDP-kxDwaolH=s48-c-k-c0x00ffffff-no-rj,http://www.youtube.com/channel/UClM0NAchtNen0r3UF7mqwdQ,{'value': 'UClM0NAchtNen0r3UF7mqwdQ'},True,none,5,2022-10-23T05:43:31Z,2022-10-23T05:43:31Z,,UgxbQMX1EsCgI6BUIOd4AaABAg
yiffzzl7EFY,Kalau udah banyak korban siapa yang bertanggung jawab,Kalau udah banyak korban siapa yang bertanggung jawab,casep cat,https://yt3.ggpht.com/VajTatqxKT83m_CfE-JvmIA6nvAdAnPMFp_Blytx-L6gvXthCtvuMiaT7w-vhrBucr3WsjCwNA=s48-c-k-c0x00ffffff-no-rj,http://www.youtube.com/channel/UCB8IImlU6z5V5IJpLG1cK-Q,{'value': 'UCB8IImlU6z5V5IJpLG1cK-Q'},True,none,1,2022-10-23T05:40:00Z,2022-10-23T05:40:00Z,,UgyAKsoI0d8OHGi29AZ4AaABAg
yiffzzl7EFY,Setuju..,Setuju..,Haura zahra,https://yt3.ggpht.com/ytc/AL5GRJXETxZyd4ZuQFba8BHZjVk5UmcQjdOHvtIxx298Aw=s48-c-k-c0x00ffffff-no-rj,http://www.youtube.com/channel/UChtNF1JoIlfWNMix64z6V1w,{'value': 'UChtNF1JoIlfWNMix64z6V1w'},True,none,0,2022-10-23T10:32:39Z,2022-10-23T10:32:39Z,UgzUfWo95R5Ylnn3xdt4AaABAg,UgzUfWo95R5Ylnn3xdt4AaABAg.9hWNJbmJDSZ9hWty-gWs8N
yiffzzl7EFY,"Semangat dokter ku,,, <br>Di luar masih banyak yg jual","Semangat dokter ku,,, 
Di luar masih banyak yg jual",Muh Darmawan,https://yt3.ggpht.com/ytc/AL5GRJUuE3h6uFkO6UGRtzsy4IK3BclPfubiBYkD8Q=s48-c-k-c0x00ffffff-no-rj,http://www.youtube.com/channel/UC2duQJsOq17Z8M8W-4-NOZw,{'value': 'UC2duQJsOq17Z8M8W-4-NOZw'},True,none,1,2022-10-23T05:35:12Z,2022-10-23T05:35:12Z,,Ugy2woTSZbqia6zt_YJ4AaABAg
yiffzzl7EFY,Kenal suara tau muka gak kenal nama 😂😂 dr Boyke,Kenal suara tau muka gak kenal nama 😂😂 dr Boyke,Hanifa Adam,https://yt3.ggpht.com/ytc/AL5GRJU3SKXWv6J-Vit_qSqeENysnqGD2G8BtTm8Dy-i4Q=s48-c-k-c0x00ffffff-no-rj,http://www.youtube.com/channel/UCx05iVQMXQQ8HYX7obEOaRQ,{'value': 'UCx05iVQMXQQ8HYX7obEOaRQ'},True,none,0,2022-10-23T05:31:31Z,2022-10-23T05:31:31Z,,UgwsnjPk4DjEIRXs8HJ4AaABAg
yiffzzl7EFY,Kalau ngasih ijin nya bisa pake amplop ya begini jd semua kena..ampun negri ku tercinta ini harus ada dulu kejadian baru heboh..yg blm pasti pun di bikin goyang heboh..,Kalau ngasih ijin nya bisa pake amplop ya begini jd semua kena..ampun negri ku tercinta ini harus ada dulu kejadian baru heboh..yg blm pasti pun di bikin goyang heboh..,Decan sipanda official,https://yt3.ggpht.com/slhBNwNwHbbqhYSThL2RgYkQOP8DJSXj7AFqTy88Ry981LlcNfkwqblr9QgKtDwahP1Cf_kNSoQ=s48-c-k-c0x00ffffff-no-rj,http://www.youtube.com/channel/UCtG5Io1AV5mVb7PWoMvmN6A,{'value': 'UCtG5Io1AV5mVb7PWoMvmN6A'},True,none,0,2022-10-23T05:31:16Z,2022-10-23T05:31:16Z,,UgytfhvE2mt_KEweLIp4AaABAg
yiffzzl7EFY,"@Veronika Ulva video yg mana kak, saya cari ga nemu, tolong dikasi tau ya video nya kak","@Veronika Ulva video yg mana kak, saya cari ga nemu, tolong dikasi tau ya video nya kak",Azel Rafardhan,https://yt3.ggpht.com/ytc/AL5GRJUSYF3zDbWWDE_AEAgwyoZcGR8LU8NAQGAdx1DTG4NCg6eWUQ_J_b22KzKfpMxa=s48-c-k-c0x00ffffff-no-rj,http://www.youtube.com/channel/UCyHv0QEFLJ_ypiwgZfSFx4g,{'value': 'UCyHv0QEFLJ_ypiwgZfSFx4g'},True,none,0,2022-10-23T14:35:15Z,2022-10-23T14:35:15Z,UgxnJ7uUBhAQJKjx9HZ4AaABAg,UgxnJ7uUBhAQJKjx9HZ4AaABAg.9hWM-h5lmNB9hXKiq7rp3m
yiffzzl7EFY,Setauq aq klo terapi kejang ga bisa skip obatnya deh mas....ada dijelasin dr.Richard di video satunya....klo ga minum bisa menimbulkan kerusakan otak....harus rutin minum Asam Valproate,Setauq aq klo terapi kejang ga bisa skip obatnya deh mas....ada dijelasin dr.Richard di video satunya....klo ga minum bisa menimbulkan kerusakan otak....harus rutin minum Asam Valproate,Veronika Ulva,https://yt3.ggpht.com/ytc/AL5GRJV6fh26F5UZnMxoISe9mTpwWaYpbSSl2zDunZ3u0PM=s48-c-k-c0x00ffffff-no-rj,http://www.youtube.com/channel/UC2bY4Wmrrb53-FRWqepEiZA,{'value': 'UC2bY4Wmrrb53-FRWqepEiZA'},True,none,0,2022-10-23T14:04:47Z,2022-10-23T14:04:47Z,UgxnJ7uUBhAQJKjx9HZ4AaABAg,UgxnJ7uUBhAQJKjx9HZ4AaABAg.9hWM-h5lmNB9hXHEhHzl0i
yiffzzl7EFY,"Sama se dunia kayanya. Krn kasus pertama itu di India merembet ke Afrika terus Indonesia. Gtau negara lain blm masuk lg beritanya. Krn ini permainan elit global percaya g percaya. Dunia ini penyakit dan segalanya ada yg mengatur. Skrg yg terjangkit negara2 miskin yg kedeteksi seperti India, Indonesia, Afrika 3 negara miskin","Sama se dunia kayanya. Krn kasus pertama itu di India merembet ke Afrika terus Indonesia. Gtau negara lain blm masuk lg beritanya. Krn ini permainan elit global percaya g percaya. Dunia ini penyakit dan segalanya ada yg mengatur. Skrg yg terjangkit negara2 miskin yg kedeteksi seperti India, Indonesia, Afrika 3 negara miskin",Aulia Yagami,https://yt3.ggpht.com/ytc/AL5GRJXPuFJnhzBuV_dxKY2aQlxlqq7uv20W_hyUFg=s48-c-k-c0x00ffffff-no-rj,http://www.youtube.com/channel/UCLWeIpvupamHKc1OzWU_PSg,{'value': 'UCLWeIpvupamHKc1OzWU_PSg'},True,none,0,2022-10-23T08:12:03Z,2022-10-23T08:12:03Z,UgxuESWs4qpfCUTGf1F4AaABAg,UgxuESWs4qpfCUTGf1F4AaABAg.9hWLpWARA0k9hWds99TZXI
yiffzzl7EFY,"@Dewi klo madu TJ sy kurang tau y mba,,,,klo sy mnmnya madu murni beli di kampung lwt teman mba e🙏🏻coba klo ada teman kesehatan tnya kn aj mba,,,","@Dewi klo madu TJ sy kurang tau y mba,,,,klo sy mnmnya madu murni beli di kampung lwt teman mba e🙏🏻coba klo ada teman kesehatan tnya kn aj mba,,,",andi yogantoro,https://yt3.ggpht.com/ytc/AL5GRJXtRZ9lK2CdAwSi8wSnEj4kQq_gsDBYZtXb6agH=s48-c-k-c0x00ffffff-no-rj,http://www.youtube.com/channel/UCj1Bp948gQO0_flji5M7Azg,{'value': 'UCj1Bp948gQO0_flji5M7Azg'},True,none,0,2022-10-23T09:44:33Z,2022-10-23T09:44:33Z,UgxAa0scT-jhfduBiXt4AaABAg,UgxAa0scT-jhfduBiXt4AaABAg.9hWLZtSvXaq9hWoSdhgKXA
yiffzzl7EFY,"@andi yogantoro madu TJ jahe mera,boleh gk itu kk,soalnya anak2 sukanya itu,","@andi yogantoro madu TJ jahe mera,boleh gk itu kk,soalnya anak2 sukanya itu,",Dewi,https://yt3.ggpht.com/CcWO1YhmzC7hy_Yj9BIQO0bEVZ1p8alZGkQg4u5Nwwy_zav7VMmxMnuMT-8y3mjlRZm5SeBjiQ=s48-c-k-c0x00ffffff-no-rj,http://www.youtube.com/channel/UCxejE_KV67ajVDDYFnq972Q,{'value': 'UCxejE_KV67ajVDDYFnq972Q'},True,none,0,2022-10-23T08:09:30Z,2022-10-23T08:09:30Z,UgxAa0scT-jhfduBiXt4AaABAg,UgxAa0scT-jhfduBiXt4AaABAg.9hWLZtSvXaq9hWd_ZdAZpQ
yiffzzl7EFY,"Selagi madu itu asli ya pasti boleh,,,,","Selagi madu itu asli ya pasti boleh,,,,",andi yogantoro,https://yt3.ggpht.com/ytc/AL5GRJXtRZ9lK2CdAwSi8wSnEj4kQq_gsDBYZtXb6agH=s48-c-k-c0x00ffffff-no-rj,http://www.youtube.com/channel/UCj1Bp948gQO0_flji5M7Azg,{'value': 'UCj1Bp948gQO0_flji5M7Azg'},True,none,0,2022-10-23T07:30:55Z,2022-10-23T07:30:55Z,UgxAa0scT-jhfduBiXt4AaABAg,UgxAa0scT-jhfduBiXt4AaABAg.9hWLZtSvXaq9hW_9vGd0XW
yiffzzl7EFY,Artinya sengaja dibuat donk dok. Terus nanti ditawari penawarnya. Mafia ini.<br>Brani ga pemerintah tutup SJ produsennya. Titik,"Artinya sengaja dibuat donk dok. Terus nanti ditawari penawarnya. Mafia ini.
Brani ga pemerintah tutup SJ produsennya. Titik",Raga Mulya,https://yt3.ggpht.com/HnmdZ8UoyHeUTrV7oZ2cUcCNbgbkqocJzbOcfa-YC5Dw067PUK-Y1fK-L8K8CgfN48ikn7vi=s48-c-k-c0x00ffffff-no-rj,http://www.youtube.com/channel/UCy0pR9o-fVFVw551vUJSd0A,{'value': 'UCy0pR9o-fVFVw551vUJSd0A'},True,none,0,2022-10-23T05:19:11Z,2022-10-23T05:19:11Z,,UgweoKb_z6UQtX-GoS14AaABAg
yiffzzl7EFY,"Dokter, tolong review obat Fomezipole yg katanya bisa jadi penawar gagal ginjal. Kok pemerintah ujug2 merekomendasikan obat ini. Waktunya juga cepet banget lagi.","Dokter, tolong review obat Fomezipole yg katanya bisa jadi penawar gagal ginjal. Kok pemerintah ujug2 merekomendasikan obat ini. Waktunya juga cepet banget lagi.",Rinanya Abee,https://yt3.ggpht.com/ytc/AL5GRJWhAmhim_3_eusZTG-VDsWs13n9AxHQUZwjNg=s48-c-k-c0x00ffffff-no-rj,http://www.youtube.com/channel/UCjqYZtCKBkWAm6kexvK1Kug,{'value': 'UCjqYZtCKBkWAm6kexvK1Kug'},True,none,3,2022-10-23T05:15:29Z,2022-10-23T05:15:29Z,,UgxmHhmQGkLbY8jCkXl4AaABAg
yiffzzl7EFY,Terima kasihh dok atas edukasi ny,Terima kasihh dok atas edukasi ny,Erniawati Erni,https://yt3.ggpht.com/ytc/AL5GRJXJg8gMBfjtnulNizyTjwEMau6DXzKQUaEi5r3u=s48-c-k-c0x00ffffff-no-rj,http://www.youtube.com/channel/UCuPLph-G6fSRl_Zn34pr8PQ,{'value': 'UCuPLph-G6fSRl_Zn34pr8PQ'},True,none,3,2022-10-23T05:11:18Z,2022-10-23T05:11:18Z,,UgxQyADq5KLCKXKB54l4AaABAg
yiffzzl7EFY,"Seru nih kalo konten dokter bahas hal2 penting kek gini, bukan pelakor pargoy dll👍 <br><br>Anyway dari vidio ini keliatan karyawan minimarket gak di edukasi sama atasan kenapa obat sirup ditarik. Taunya cuma stok lagi habis / udah gak jual, dll","Seru nih kalo konten dokter bahas hal2 penting kek gini, bukan pelakor pargoy dll👍 

Anyway dari vidio ini keliatan karyawan minimarket gak di edukasi sama atasan kenapa obat sirup ditarik. Taunya cuma stok lagi habis / udah gak jual, dll",shzmafs,https://yt3.ggpht.com/ytc/AL5GRJXF095x_I4iUYtwvF50kfTod-mh07hkQzQ8bCtLu2_MwvivNXplVlSEP2-NXkZA=s48-c-k-c0x00ffffff-no-rj,http://www.youtube.com/channel/UCV1X2h5_XDG9kV695VvZVgA,{'value': 'UCV1X2h5_XDG9kV695VvZVgA'},True,none,10,2022-10-23T05:08:55Z,2022-10-23T05:26:46Z,,UgywTDVviH14k9ILZtR4AaABAg
yiffzzl7EFY,Hati hati ya dok takut nya,Hati hati ya dok takut nya,lailiya lail,https://yt3.ggpht.com/kfbjXisnikwU-KNRpv87QotGiUg5xQrWZW4axxqfgriYWCzlepfysh8sCpq3lYZrRl0Eezo8YQ=s48-c-k-c0x00ffffff-no-rj,http://www.youtube.com/channel/UC6M-OlEB56e1Al3VzLL4M0g,{'value': 'UC6M-OlEB56e1Al3VzLL4M0g'},True,none,0,2022-10-23T05:07:45Z,2022-10-23T05:07:45Z,,UgzC3bA5yGDq5u749LJ4AaABAg
yiffzzl7EFY,Auto beli mnyak angin c dokter😂,Auto beli mnyak angin c dokter😂,Ayahibuzie,https://yt3.ggpht.com/0JQfp1ae1Xwl9iA6OueIAbrhiNgvwZqzxGYPPlYD36Dga98VZGaCgB1OkF9nM5MS8dBJZEFK0Q=s48-c-k-c0x00ffffff-no-rj,http://www.youtube.com/channel/UCX0IPxqbl-swMvIDrHtIRDA,{'value': 'UCX0IPxqbl-swMvIDrHtIRDA'},True,none,0,2022-10-23T05:05:00Z,2022-10-23T05:05:00Z,,Ugz2C_zWa0uOrDPqZqR4AaABAg
yiffzzl7EFY,"Dia kn cm ngetes doang emng ada yg slh ya,,,,dia pura&quot; nya ngeyel beli itu hny pura&quot; mas","Dia kn cm ngetes doang emng ada yg slh ya,,,,dia pura"" nya ngeyel beli itu hny pura"" mas",andi yogantoro,https://yt3.ggpht.com/ytc/AL5GRJXtRZ9lK2CdAwSi8wSnEj4kQq_gsDBYZtXb6agH=s48-c-k-c0x00ffffff-no-rj,http://www.youtube.com/channel/UCj1Bp948gQO0_flji5M7Azg,{'value': 'UCj1Bp948gQO0_flji5M7Azg'},True,none,1,2022-10-23T07:43:37Z,2022-10-23T07:43:37Z,UgxVwHbXwv9kvRePej14AaABAg,UgxVwHbXwv9kvRePej14AaABAg.9hWJHKqpmDg9hWabwUkXRk
yiffzzl7EFY,Olshop masih banyak yang jual 😂,Olshop masih banyak yang jual 😂,Ilham Berlianto,https://yt3.ggpht.com/ytc/AL5GRJVQo3x14g3kREzz56lp9BaXVp3I2aWduKsONLMgug=s48-c-k-c0x00ffffff-no-rj,http://www.youtube.com/channel/UCG6NaaNg_5GSwaripya4Tpw,{'value': 'UCG6NaaNg_5GSwaripya4Tpw'},True,none,2,2022-10-23T05:01:26Z,2022-10-23T05:01:26Z,,Ugz1D-TUzLXAKx6Enb94AaABAg
